{
  "summary": "Agent 已完成修改并通过类型检查，但没有运行端到端测试。",
  "status": "partial",
  "actionsTaken": ["更新了登录表单和路由守卫"],
  "verificationResults": ["npm run typecheck 通过", "未运行端到端测试"],
  "userDecisionsNeeded": [],
  "risksAndWarnings": ["真实登录服务尚未联调"],
  "suggestedNextSteps": ["连接测试环境后运行登录端到端测试"],
  "preservedTechnicalDetails": {
    "commands": ["npm run typecheck"],
    "filePaths": ["src/features/auth/LoginForm.tsx"],
    "errors": [],
    "codeSnippets": [],
    "warnings": ["E2E not run"]
  },
  "outputLanguage": "zh"
}
